שם,מדינה,תקופה,תחום,עבודות בולטות,הערות,ציטוטים,מקורות,תגיות
פול ראנד (Paul Rand),"ארה""ב",מודרניזם של אמצע המאה (1940–1970),מעצבים גרפיים,"לוגו IBM, לוגו ABC, לוגו UPS, זהות וסטינגהאוס, מחשבות על עיצוב","אחד ממעצבי הזהות התאגידית המשפיעים ביותר. הביא את הבהירות המודרניסטית האירופית לפרסום האמריקאי. דגל בעיצוב כתקשורת, לא כקישוט.",אל תנסה להיות מקורי; פשוט נסה להיות טוב.,https://www.pinterest.com/search/pins/?q=paul%20rand&rs=typed,"מיתוג, זהות תאגידית, רציונליזם, טיפוגרפיה"
ברברה קרוגר (Barbara Kruger),"ארה""ב",פוסט-מודרני / קונספטואלי (1980–2000),מעצבים גרפיים,"ללא כותרת (הגוף שלך הוא שדה קרב), אני קונה משמע אני קיים, אתה לא עצמך","משתמשת בטיפוגרפיה נועזת (Futura) ובקומפוזיציות אדום-לבן-שחור כדי לבקר את תרבות הצריכה, המגדר והכוח.",אני עובדת עם תמונות ומילים כי יש להן את היכולת לקבוע מי אנחנו ומי אנחנו לא.,https://www.pinterest.com/search/pins/?q=barbara%20kruger&rs=ac&len=10&source_id=ac_moAjZBlK&eq=barbara%20kr&etslf=3814,"קולאז', צרכנות, זהות תאגידית, פמיניזם, מחאה, אדום, טיפוגרפיה"
צ'ארלס ברנס (Charles Burns),"ארה""ב",מעבר ממודרניזם מאוחר לפוסט-מודרניזם (1960–1990),מאיירים,"Black Hole, טרילוגיית X’ed Out, Big Baby, El Borbah","ידוע באיוריו השחור-לבן בעלי הניגודיות הגבוהה, המערבבים אמריקנה של שנות ה-50 עם אימת גוף והתבגרות.",אני מתעניין במה שמתחת לפני השטח — העולם האפל והבלתי נראה שאנשים מנסים להסתיר.,https://www.pinterest.com/search/pins/?q=charles%20burns&rs=typed,"שחור-לבן, קומיקס, ניגודיות, סוריאליזם, סימבוליזם"
בוב מקים (Bob McKim),"ארה""ב",מודרניזם מאוחר (1970–1990),מעצבים תעשייתיים,"תוכנית ""עיצוב מוצר"" בסטנפורד, שיטות חימום ליצירתיות (מבחן 30 העיגולים)","לימד את הקורסים האגדיים ""חשיבה חזותית"" ו""עיצוב מוצר"" בסטנפורד. פיתח תרגילים יצירתיים משפיעים ועיצב את תרבות החשיבה העיצובית המוקדמת.",אל תחשוב — תצייר.,https://stanfordmag.org/contents/product-design-visionary,"יצירתיות, חינוך, חשיבה חזותית"
דייוויד קרסון (David Carson),"ארה""ב",פוסט-מודרני / קונספטואלי (1980–2000),מעצבים גרפיים,"מגזין Ray Gun, תרבות חוף, סוף הדפוס","שבר את חוקי הטיפוגרפיה כדי ליצור עיצוב כאוטי ורגשי. הדגיש אינטואיציה ומרקם על פני קריאות. הגדיר את אסתטיקת ה""גראנג'"" של שנות ה-90.",אל תבלבל קריאות עם תקשורת.,https://www.pinterest.com/search/pins/?q=david%20carson&rs=typed,"כאוס, קולאז', דקונסטרוקציה, גראנג', מרקם, טיפוגרפיה"
דייוויד קלי (David Kelley),"ארה""ב",פוסט-מודרני / קונספטואלי (1980–2000),מעצבים תעשייתיים,"מייסד IDEO, ד.סקול בסטנפורד, עכבר אפל (בהובלת צוות), עיצוב ממוקד אדם","חלוץ העיצוב הממוקד באדם ויצירתיות רגשית מבוססת צוות. בנה את IDEO סביב שיתוף פעולה, יצירת אבות-טיפוס ואמפתיה.",תכשל מהר יותר כדי להצליח מוקדם יותר.,https://en.wikipedia.org/wiki/David_M._Kelley,"חשיבה עיצובית, חינוך, אנושי, חדשנות, עיצוב מוצר"
טום פיליפס (Tom Phillips),הממלכה המאוחדת,מעבר ממודרניזם מאוחר לפוסט-מודרניזם (1960–1990),קונספטואלי,"A Humument, אופרת אירמה, 20 אתרים ב-n שנים","יצר את A Humument על ידי ציור, קולאז' ושכתוב של רומן ויקטוריאני ישן, והפך אותו לשירה חזותית. מדיטציה על מקריות, שפה ומשמעות.",כל עמוד שעבדתי עליו היה שיחה בין הטקסט הישן לחדש.,https://www.pinterest.com/search/pins/?q=tom%20phillips&rs=ac&len=8&source_id=ac_vjAQCDeE&eq=tom%20phil&etslf=5946,"קולאז', קונספטואלי, ספרות, מדיה מעורבת, שירה, טיפוגרפיה"
ג'ון ארנולד (John Arnold),"ארה""ב",מודרניזם מאוחר (1970–1990),מעצבים תעשייתיים,"קורס ""הנדסה יצירתית"" בסטנפורד, מסגרות חשיבה עיצובית מוקדמות","נחשב לאחד האבות המייסדים של החשיבה העיצובית. הכניס יצירתיות, אמפתיה ומסגור בעיות לחינוך ההנדסי.",חשיבה יצירתית מתחילה במסגור מחדש של ההנחות שלך.,,"IDEO, יצירתיות, חשיבה עיצובית, חינוך, חדשנות, מסגור מחדש"
מארק רותקו (Mark Rothko),"ארה""ב",,ציירים,"ציורי שדות צבע (ללא כותרת, מס' 14), קפלת רוטקו",ממובילי האקספרסיוניזם המופשט. ידוע בציורי שדות הצבע הגדולים שנועדו לעורר חוויה רגשית ורוחנית עמוקה אצל הצופה.,אני לא מתעניין ביחסים בין צבע וצורה... אני מתעניין רק בהבעת רגשות אנושיים בסיסיים.,,
ג'ני הולצר (Jenny Holzer),"ארה""ב",פוסט-מודרני / קונספטואלי (1980–2000),קונספטואלי,"Truisms, הגן עלי מפני מה שאני רוצה, סדרת הישרדות, הקרנות LED","ידועה במיצגים מבוססי טקסט והקרנות ציבוריות החוקרים אמת, אלימות ומערכות חברתיות. הופכת שפה לאור, ארכיטקטורה ועימות.",הגן עלי מפני מה שאני רוצה.,https://www.pinterest.com/search/pins/?q=jenny%20holzer%20art&rs=ac&len=12&source_id=ac_3ABlw3ao&eq=jenny%20holzer&etslf=1043,"לד, קונספטואלי, פמיניזם, פוליטיקה, טקסט כתמונה, אמת"
פריצ'ה פאן-קלום (Preecha Pun-Klum),תאילנד,עכשווי (2000–הווה),ציירים,"מחקר טיפוגרפיה תאילנדית, סדרת כרזות תרבות, גופן Krungthep",מעצב וחוקר המשפיע על התפתחות הטיפוגרפיה התאילנדית המודרנית. משלב אלמנטים מסורתיים עם עקרונות עיצוב עכשוויים.,הכתב הוא המראה של התרבות.,https://www.number1gallery.com/Artist.aspx?name=preecha-pun-klum,"עיר, תנועה, פוינטיליזם"
בן קלי (Ben Kelly),הממלכה המאוחדת,פוסט-מודרני / קונספטואלי (1980–2000),,"מועדון ההסיינדה (מנצ'סטר), חללי מועדונים, ארכיטקטורת מועדונים תעשייתית","ידוע בעיקר בעיצוב מועדון ההסיינדה, חלל מכונן בתרבות המועדונים והאסתטיקה הפוסט-תעשייתית. עבודתו תרגמה חומרים תעשייתיים לחללים חברתיים סוחפים.",ארכיטקטורה יכולה להגדיר התנהגות לפני שהיא מגדירה צורה.,https://benkellydesign.com/,"ניסויי, תעשייה, פנים, תרבות מוזיקה, שילוט, צבע חתימה"
כריסטיאן מרקליי (Cristian Marclay),"ארה""ב/שוויץ",עכשווי (2000–הווה),מעצבים גרפיים,"השעון (2010), טלפונים, רביעיות וידאו","ממזג וידאו מונטאז', סאונד, קולנוע וזמן. ""השעון"" הוא סרט באורך 24 שעות העשוי מאלפי קטעי סרטים המסונכרנים לזמן אמת. חוקר זיכרון קולקטיבי ומקצב.",אני מתעניין באיך שסאונד ותמונה מתנגשים ויוצרים משמעות.,https://www.pinterest.com/search/pins/?q=Cristian%20Marclay&rs=typed,"קונספטואלי, וידאו מצוי, מונטאז', דגימה, זמן, וידאו"
הנס המרט (Hans Hemmert),גרמניה,עכשווי (2000–הווה),פסלים,"פסלי בלונים / פסלים צהובים, מיצגי ""Level"", פרויקטי תחנת חלל","חבר בקבוצת האמנות Gelatin, הידועה במיצגים אבסורדיים ומשחקיים. עבודות הסולו שלו חוקרות זהות, קנה מידה והומור — לרוב באמצעות חליפות בלונים המנפחות פרופורציות אנושיות.",אני אוהב להסיט את הגוף לטריטוריה לא מוכרת — שם מתחילה ההבנה.,https://www.pinterest.com/search/pins/?q=Hans%20Hemmert&rs=typed,"ג'לטין, אבסורד, בלון, קונספטואלי, הומור, אמנות מיצג, פיסול, טרנספורמציה"
ליו בולין (Liu Bolin),סין,עכשווי (2000–הווה),צלמים,"להתחבא בעיר, צל","ידוע כ""האיש הבלתי נראה"". מצייר על גופו כדי להשתלב בסביבה, כהערה על מחיקה, צרכנות וחוסר נראות חברתי.",להיעלם זה לחשוף משהו.,https://www.pinterest.com/search/pins/?q=liu%20bolin&rs=typed,"הסוואה, אמנות מיצג, צילום, פוליטיקה"
סופי קאל (Sophie Calle),צרפת,עכשווי (2000–הווה),קונספטואלי,"הסוויטה הוונציאנית, שמור על עצמך, המלון, ספר הכתובות","משתמשת בטקסט, צילום ומיצג כדי לחקור פרטיות, זהות ומעקב. מטשטשת את הגבול בין אמנות לחיים באמצעות חקירות וסיפורים רגשיים.",אני רואה את עצמי כרוח רפאים המרחפת מעל חייהם של אנשים אחרים.,https://www.pinterest.com/search/pins/?q=sophie%20calle&rs=typed,"קונספטואלי, זהות תאגידית, נרטיב, צילום, מעקב, מרקם"
ויק מוניז (Vik Muniz),"ברזיל/ארה""ב",עכשווי (2000–הווה),צלמים,"אמנות בזבל (Waste Land), תמונות משוקולד, תמונות מגרוטאות","משחזר דימויים אייקוניים באמצעות חומרים לא שגרתיים כמו זבל, סוכר, שוקולד וצעצועים. עבודותיו מדגישות תפיסה, זיכרון וטרנספורמציה.",אני יוצר תמונות מהחומרים הצנועים ביותר כדי להראות שהיופי נמצא בכל מקום.,https://www.pinterest.com/search/pins/?q=vik%20muniz&rs=typed,"זבל, חומרים, מדיה מעורבת, שחזור, פרשנות חברתית, שממה"
קשישטוף וודיצ'קו (Krzysztof Wodiczko),"פולין/ארה""ב",פוסט-מודרני / קונספטואלי (1980–2000),קונספטואלי,"הקרנות ציבוריות, הקרנת הירושימה, הקרנת טיחואנה","מקרין קולות של אנשים מוחלשים על אנדרטאות. הופך ארכיטקטורה לפלטפורמה לעדות, טראומה וצדק חברתי.",אני מחזיר את האנדרטה לאנשים שהושתקו על ידה.,https://www.pinterest.com/search/pins/?q=Krzysztof%20Wodiczko&rs=typed,"אקטיביזם, אדריכלות, פוליטיקה, הקרנה, טראומה"
אדם יקותיאלי (Adam Yekutieli),ישראל,עכשווי (2000–הווה),מעצבים גרפיים,"הדפסי סטטיק ובן אל, חומות, מיצגי שירה פוליטית","עובד עם טקסט, נייר וסמלים שבריריים העוסקים בזהות, סכסוך, געגוע ותקווה. יוצר מיצבים המרגישים אינטימיים ופוליטיים בו זמנית.",תקווה היא המרחק בין המקום שבו אנו עומדים לבין מה שאנו כמהים אליו.,https://thisislimbo.com/projects/,"סכסוך, שירה, אמנות רחוב, סימבוליזם, טקסט"
